{
  "browserId": [],
  "campaignStatus": [],
  "concurrent_save_allowed": true,
  "created_time": 1234567890,
  "emailBounceStatus": [],
  "entity_type": "company_entity",
  "formId": 0,
  "id": 1234567890123456,
  "is_client_import": false,
  "is_duplicate_existed": false,
  "is_duplicate_verification_failed": false,
  "is_lead_converted": false,
  "klout_score": "",
  "last_called": 0,
  "last_campaign_emaild": 0,
  "last_contacted": 0,
  "last_emailed": 0,
  "lead_converted_time": 0,
  "lead_score": 0,
  "lead_source_id": 0,
  "lead_status_id": 0,
  "owner": {
    "calendarURL": "<URL>",
    "calendar_url": "<URL>",
    "domain": "<DOMAIN>",
    "email": "<EMAIL_EXAMPLE>",
    "id": 1234567890123456,
    "name": "<OWNER_NAME>",
    "phone": "<OWNER_PHONE>",
    "pic": "<URI>",
    "schedule_id": "<SCHEDULE_ID>"
  },
  "properties": [
    {
      "name": "<name>",
      "type": "SYSTEM",
      "subtype": "<SUBTYPE>",
      "value": "<VALUE>"
    },
    {
      "name": "<name>",
      "type": "SYSTEM",
      "value": "<VALUE>"
    }
  ],
  "restored_time": 0,
  "star_value": 0,
  "tags": [
    "<tag1>",
    "<tag2>"
  ],
  "tagsWithTime": [
    {
      "tag": "<tag1>",
      "createdTime": 1234567890,
      "availableCount": 0,
      "entity_type": "tag"
    }
  ],
  "trashed_time": 0,
  "type": "COMPANY",
  "unsubscribeStatus": [],
  "updated_time": 0,
  "viewed": {
    "viewed_time": 0
  },
  "viewed_time": 0
}